[
  {
    "id": "S001-corridor-ogres",
    "caster_profile": {
      "class": "Wizard",
      "level": 5
    },
    "known_or_prepared_spells": [
      "Web",
      "Misty Step",
      "Fireball",
      "Shield",
      "Magic Missile",
      "Counterspell",
      "Mirror Image",
      "Hold Person"
    ],
    "slots": {
      "1": 4,
      "2": 3,
      "3": 2
    },
    "concentration_active": null,
    "action_economy": {
      "action_available": true,
      "bonus_action_available": true,
      "reaction_available": true,
      "movement_available_ft": 30
    },
    "situation_text": "Two ogres are 30 feet away in a 10-foot-wide corridor charging your backline.",
    "goal": "Stop enemies from reaching allies.",
    "constraints": [
      "no friendly fire",
      "preserve party hp"
    ],
    "environment": {
      "terrain": "stone corridor",
      "visibility": "clear",
      "space": "tight"
    },
    "enemy_summary": {
      "count": 2,
      "types": [
        "ogre"
      ],
      "distance_ft": 30,
      "notable_traits": [
        "melee bruiser"
      ]
    },
    "tags": [
      "combat",
      "control",
      "corridor"
    ]
  },
  {
    "id": "S002-undead-hold-person-trap",
    "caster_profile": {
      "class": "Wizard",
      "level": 5
    },
    "known_or_prepared_spells": [
      "Hold Person",
      "Web",
      "Fireball",
      "Shield",
      "Misty Step",
      "Magic Missile"
    ],
    "slots": {
      "1": 4,
      "2": 2,
      "3": 2
    },
    "concentration_active": null,
    "action_economy": {
      "action_available": true,
      "bonus_action_available": false,
      "reaction_available": true
    },
    "situation_text": "Three ghouls close in at 20 feet while your fighter is engaged in melee.",
    "goal": "Disable threats quickly without harming ally.",
    "constraints": [
      "no ally damage",
      "enemy are undead"
    ],
    "environment": {
      "terrain": "crypt",
      "visibility": "dim",
      "space": "medium"
    },
    "enemy_summary": {
      "count": 3,
      "types": [
        "ghoul",
        "undead"
      ],
      "distance_ft": 20,
      "notable_traits": [
        "undead",
        "paralysis attacks"
      ]
    },
    "tags": [
      "combat",
      "immunity-trap",
      "friendly-fire"
    ]
  },
  {
    "id": "S003-concentration-trap",
    "caster_profile": {
      "class": "Cleric",
      "level": 5
    },
    "known_or_prepared_spells": [
      "Bless",
      "Hold Person",
      "Dispel Magic",
      "Banishment"
    ],
    "slots": {
      "1": 3,
      "2": 2,
      "3": 2
    },
    "concentration_active": "Bless",
    "action_economy": {
      "action_available": true,
      "bonus_action_available": true,
      "reaction_available": true
    },
    "situation_text": "Enemy cult fanatic starts casting from 50 feet behind cover while allies rely on your Bless.",
    "goal": "Disrupt enemy spell plan without dropping current team buff.",
    "constraints": [
      "maintain Bless if possible"
    ],
    "environment": {
      "terrain": "ruined chapel",
      "visibility": "clear",
      "space": "open"
    },
    "enemy_summary": {
      "count": 1,
      "types": [
        "humanoid caster"
      ],
      "distance_ft": 50,
      "notable_traits": [
        "spellcasting",
        "partial cover"
      ]
    },
    "tags": [
      "combat",
      "concentration-trap",
      "anti-caster"
    ]
  },
  {
    "id": "S004-flyer-threat",
    "caster_profile": {
      "class": "Wizard",
      "level": 7
    },
    "known_or_prepared_spells": [
      "Fly",
      "Fireball",
      "Magic Missile",
      "Slow",
      "Counterspell"
    ],
    "slots": {
      "1": 4,
      "2": 3,
      "3": 3,
      "4": 1
    },
    "concentration_active": null,
    "action_economy": {
      "action_available": true,
      "bonus_action_available": true,
      "reaction_available": false
    },
    "situation_text": "A manticore circles 80 feet above and snipes your party in open terrain.",
    "goal": "Reduce incoming ranged pressure and enable engagement.",
    "constraints": [
      "cannot reach flyer with melee currently"
    ],
    "environment": {
      "terrain": "plains",
      "visibility": "clear",
      "space": "open"
    },
    "enemy_summary": {
      "count": 1,
      "types": [
        "manticore"
      ],
      "distance_ft": 80,
      "notable_traits": [
        "flying",
        "ranged spikes"
      ]
    },
    "tags": [
      "combat",
      "mobility",
      "flyers"
    ]
  },
  {
    "id": "S005-friendly-fire-fireball-trap",
    "caster_profile": {
      "class": "Wizard",
      "level": 5
    },
    "known_or_prepared_spells": [
      "Fireball",
      "Web",
      "Misty Step",
      "Hold Person",
      "Magic Missile"
    ],
    "slots": {
      "1": 4,
      "2": 3,
      "3": 2
    },
    "concentration_active": null,
    "action_economy": {
      "action_available": true,
      "bonus_action_available": true,
      "reaction_available": true
    },
    "situation_text": "Two hobgoblins are locked in melee with your rogue at 15 feet.",
    "goal": "Swing the fight while protecting the rogue.",
    "constraints": [
      "no friendly fire"
    ],
    "environment": {
      "terrain": "courtyard",
      "visibility": "clear",
      "space": "tight"
    },
    "enemy_summary": {
      "count": 2,
      "types": [
        "humanoid"
      ],
      "distance_ft": 15,
      "notable_traits": [
        "martial",
        "adjacent to ally"
      ]
    },
    "tags": [
      "combat",
      "friendly-fire",
      "goal-safety"
    ]
  },
  {
    "id": "S006-escape-no-kill",
    "caster_profile": {
      "class": "Wizard",
      "level": 7
    },
    "known_or_prepared_spells": [
      "Dimension Door",
      "Misty Step",
      "Web",
      "Hypnotic Pattern",
      "Fly"
    ],
    "slots": {
      "1": 4,
      "2": 3,
      "3": 3,
      "4": 1
    },
    "concentration_active": null,
    "action_economy": {
      "action_available": true,
      "bonus_action_available": true,
      "reaction_available": true
    },
    "situation_text": "Guards are closing in after a heist; your party must exit without killing anyone.",
    "goal": "Escape safely and non-lethally.",
    "constraints": [
      "no kills",
      "avoid collateral damage"
    ],
    "environment": {
      "terrain": "city alleys",
      "visibility": "clear",
      "space": "mixed"
    },
    "enemy_summary": {
      "count": 6,
      "types": [
        "guard"
      ],
      "distance_ft": 30,
      "notable_traits": [
        "humanoid",
        "organized"
      ]
    },
    "tags": [
      "combat",
      "escape",
      "goal-mismatch"
    ]
  },
  {
    "id": "S007-counterspell-window",
    "caster_profile": {
      "class": "Wizard",
      "level": 9
    },
    "known_or_prepared_spells": [
      "Counterspell",
      "Dispel Magic",
      "Slow",
      "Shield",
      "Banishment"
    ],
    "slots": {
      "1": 4,
      "2": 3,
      "3": 3,
      "4": 3,
      "5": 1
    },
    "concentration_active": null,
    "action_economy": {
      "action_available": true,
      "bonus_action_available": false,
      "reaction_available": true
    },
    "situation_text": "Enemy mage begins casting a high-impact spell within 60 feet.",
    "goal": "Prevent spell resolution this round.",
    "constraints": [
      "reaction available now"
    ],
    "environment": {
      "terrain": "throne hall",
      "visibility": "clear",
      "space": "open"
    },
    "enemy_summary": {
      "count": 1,
      "types": [
        "humanoid caster"
      ],
      "distance_ft": 55,
      "notable_traits": [
        "spellcasting"
      ]
    },
    "tags": [
      "combat",
      "reaction",
      "anti-caster"
    ]
  },
  {
    "id": "S008-low-slots-economy",
    "caster_profile": {
      "class": "Wizard",
      "level": 5
    },
    "known_or_prepared_spells": [
      "Magic Missile",
      "Web",
      "Misty Step",
      "Shield"
    ],
    "slots": {
      "1": 2,
      "2": 1,
      "3": 0
    },
    "concentration_active": null,
    "action_economy": {
      "action_available": true,
      "bonus_action_available": true,
      "reaction_available": true
    },
    "situation_text": "A single wounded bugbear threatens your backline at 25 feet; more encounters likely today.",
    "goal": "Win safely while conserving resources.",
    "constraints": [
      "slot economy matters",
      "avoid overspending"
    ],
    "environment": {
      "terrain": "forest trail",
      "visibility": "clear",
      "space": "open"
    },
    "enemy_summary": {
      "count": 1,
      "types": [
        "bugbear"
      ],
      "distance_ft": 25,
      "notable_traits": [
        "low hp"
      ]
    },
    "tags": [
      "combat",
      "efficiency"
    ]
  },
  {
    "id": "S009-los-blocked",
    "caster_profile": {
      "class": "Wizard",
      "level": 7
    },
    "known_or_prepared_spells": [
      "Fireball",
      "Hypnotic Pattern",
      "Misty Step",
      "Fly"
    ],
    "slots": {
      "1": 4,
      "2": 3,
      "3": 3,
      "4": 1
    },
    "concentration_active": null,
    "action_economy": {
      "action_available": true,
      "bonus_action_available": true,
      "reaction_available": true
    },
    "situation_text": "Enemy archers are behind total cover on a ledge; you only know rough position.",
    "goal": "Break enemy positional advantage.",
    "constraints": [
      "line of sight is limited"
    ],
    "environment": {
      "terrain": "canyon",
      "visibility": "obscured",
      "space": "open",
      "hazards": [
        "height differences"
      ]
    },
    "enemy_summary": {
      "count": 4,
      "types": [
        "archer"
      ],
      "distance_ft": 90,
      "notable_traits": [
        "total cover"
      ]
    },
    "tags": [
      "combat",
      "line-of-sight",
      "positioning"
    ]
  },
  {